{
  "schemaVersion": "office-building-topology-v1",
  "building": { "id": { "kind": "building", "value": "hq" }, "version": 1 },
  "siteEnvelope": {
    "id": "hq-target-site",
    "version": 1,
    "presentationOnly": true,
    "contextKinds": ["backdrop", "curb", "planting", "road", "sidewalk"],
    "contextCells": [
      { "kind": "backdrop", "coordinate": { "space": "site-cell", "x": 45, "y": 5 } },
      { "kind": "curb", "coordinate": { "space": "site-cell", "x": 8, "y": 8 } },
      { "kind": "road", "coordinate": { "space": "site-cell", "x": 0, "y": 8 } },
      { "kind": "road", "coordinate": { "space": "site-cell", "x": 1, "y": 8 } },
      { "kind": "road", "coordinate": { "space": "site-cell", "x": 2, "y": 8 } },
      { "kind": "road", "coordinate": { "space": "site-cell", "x": 3, "y": 8 } },
      { "kind": "road", "coordinate": { "space": "site-cell", "x": 4, "y": 8 } },
      { "kind": "road", "coordinate": { "space": "site-cell", "x": 5, "y": 8 } },
      { "kind": "road", "coordinate": { "space": "site-cell", "x": 6, "y": 8 } },
      { "kind": "road", "coordinate": { "space": "site-cell", "x": 7, "y": 8 } },
      { "kind": "road", "coordinate": { "space": "site-cell", "x": 8, "y": 8 } },
      { "kind": "road", "coordinate": { "space": "site-cell", "x": 9, "y": 8 } },
      { "kind": "road", "coordinate": { "space": "site-cell", "x": 10, "y": 8 } },
      { "kind": "road", "coordinate": { "space": "site-cell", "x": 11, "y": 8 } },
      { "kind": "road", "coordinate": { "space": "site-cell", "x": 12, "y": 8 } },
      { "kind": "road", "coordinate": { "space": "site-cell", "x": 13, "y": 8 } },
      { "kind": "road", "coordinate": { "space": "site-cell", "x": 14, "y": 8 } },
      { "kind": "road", "coordinate": { "space": "site-cell", "x": 15, "y": 8 } },
      { "kind": "sidewalk", "coordinate": { "space": "site-cell", "x": 9, "y": 9 } },
      { "kind": "sidewalk", "coordinate": { "space": "site-cell", "x": 9, "y": 10 } },
      { "kind": "sidewalk", "coordinate": { "space": "site-cell", "x": 9, "y": 11 } },
      { "kind": "sidewalk", "coordinate": { "space": "site-cell", "x": 9, "y": 12 } },
      { "kind": "sidewalk", "coordinate": { "space": "site-cell", "x": 9, "y": 13 } },
      { "kind": "planting", "coordinate": { "space": "site-cell", "x": 42, "y": 10 } },
      { "kind": "planting", "coordinate": { "space": "site-cell", "x": 42, "y": 11 } }
    ]
  },
  "floors": [
    {
      "floor": { "id": { "kind": "floor", "value": "hq-ground-floor" }, "version": 1 },
      "world": { "id": "hq-ground-floor", "version": 1 },
      "coordinateSpace": "floor-local",
      "bounds": { "width": 32, "depth": 24, "maxElevation": 2 },
      "siteFootprint": [
        { "space": "site-cell", "x": 10, "y": 10 },
        { "space": "site-cell", "x": 41, "y": 10 },
        { "space": "site-cell", "x": 10, "y": 33 },
        { "space": "site-cell", "x": 41, "y": 33 }
      ],
      "identitySource": "declared"
    }
  ],
  "portals": [
    {
      "id": "main-entrance",
      "version": 1,
      "kind": "entrance",
      "ownerFloor": { "id": { "kind": "floor", "value": "hq-ground-floor" }, "version": 1 },
      "direction": "bidirectional",
      "endpoint": {
        "id": "ground-entrance",
        "version": 1,
        "ownerKind": "floor",
        "floor": { "id": { "kind": "floor", "value": "hq-ground-floor" }, "version": 1 },
        "coordinate": {
          "space": "floor-local-cell",
          "floor": { "id": { "kind": "floor", "value": "hq-ground-floor" }, "version": 1 },
          "coordinate": { "space": "cell", "x": 2, "y": 2, "elevation": 0 }
        }
      },
      "landing": {
        "id": "site-entrance",
        "version": 1,
        "ownerKind": "site",
        "site": { "id": "hq-target-site", "version": 1 },
        "siteCoordinate": { "space": "site-cell", "x": 9, "y": 11 }
      }
    }
  ]
}
